Title,Media URL,Pinterest board,Description,Link,Publish date,Keywords
Stop Free generators add a loud,https://gomovecalc.xyz/pins/pin-211.png,AI Audio Tools,"Tired of Free generators add a loud watermark that ruins my video's professional feel? Try this free AI audio tools — no signup, instant results. wavecraft.8zla.com",https://wavecraft.8zla.com/,2026-07-13T01:22:00+00:00,"#AIaudiotools, #freetool, #comparison, #nocode, #indiehacker"
How to Best AI Voice Generator for YouTube Videos: Honest Comparison,https://gomovecalc.xyz/pins/pin-212.png,AI Audio Tools,Step-by-step: use our free AI audio tools to get accurate estimates in 30 seconds. No email required.,https://wavecraft.8zla.com/,2026-07-13T02:32:00+00:00,"#AIaudiotools, #freetool, #comparison, #nocode, #indiehacker"
WaveCraft vs Paying a Pro: Real Cost Difference,https://gomovecalc.xyz/pins/pin-213.png,AI Audio Tools,"Before you hire someone, run the numbers. Free AI audio tools saves you from overpaying. wavecraft.8zla.com",https://wavecraft.8zla.com/,2026-07-13T04:00:00+00:00,"#AIaudiotools, #freetool, #comparison, #nocode, #indiehacker"
One Thing Most People Get Wrong About AI audio tools,https://gomovecalc.xyz/pins/pin-214.png,AI Audio Tools,Don't guess — calculate. Our free tool uses real industry data. wavecraft.8zla.com,https://wavecraft.8zla.com/,2026-07-13T04:11:00+00:00,"#AIaudiotools, #freetool, #comparison, #nocode, #indiehacker"
WaveCraft: The Free Tool That Replaces Spreadsheets,https://gomovecalc.xyz/pins/pin-215.png,AI Audio Tools,"No Excel, no math, no signup. Just open and calculate. AI audio tools — wavecraft.8zla.com",https://wavecraft.8zla.com/,2026-07-13T05:15:00+00:00,"#AIaudiotools, #freetool, #comparison, #nocode, #indiehacker"
Real Numbers: What AI audio tools Actually Costs in 2026,https://gomovecalc.xyz/pins/pin-216.png,AI Audio Tools,Updated 2026 pricing data. Free AI audio tools with breakdown by category. wavecraft.8zla.com,https://wavecraft.8zla.com/,2026-07-13T06:26:00+00:00,"#AIaudiotools, #freetool, #comparison, #nocode, #indiehacker"
Which AI Option Is Right For You?,https://gomovecalc.xyz/pins/pin-217.png,AI Audio Tools,Answer 3 quick inputs and our free calculator tells you. No signup. wavecraft.8zla.com,https://wavecraft.8zla.com/,2026-07-13T07:15:00+00:00,"#AIaudiotools, #freetool, #comparison, #nocode, #indiehacker"
Before Buying AI audio: Run This First,https://gomovecalc.xyz/pins/pin-218.png,AI Audio Tools,5 minutes of planning saves thousands. Free AI audio tools → wavecraft.8zla.com,https://wavecraft.8zla.com/,2026-07-13T08:41:00+00:00,"#AIaudiotools, #freetool, #comparison, #nocode, #indiehacker"
The Ultimate AI audio tools Checklist (Free Tool Inside),https://gomovecalc.xyz/pins/pin-219.png,AI Audio Tools,Everything you need to know before starting. Plus a free calculator. wavecraft.8zla.com,https://wavecraft.8zla.com/,2026-07-13T09:35:00+00:00,"#AIaudiotools, #freetool, #comparison, #nocode, #indiehacker"
Industry Secret: How Pros Estimate AI audio Costs,https://gomovecalc.xyz/pins/pin-220.png,AI Audio Tools,We reverse-engineered professional pricing formulas. Try them free. wavecraft.8zla.com,https://wavecraft.8zla.com/,2026-07-13T10:54:00+00:00,"#AIaudiotools, #freetool, #comparison, #nocode, #indiehacker"
Stop Lists are just affiliate blogs,https://gomovecalc.xyz/pins/pin-221.png,AI Data Tools,"Tired of Lists are just affiliate blogs regurgitating the same tools without real testing.? Try this free AI data analysis tools — no signup, instant results. datatooltrove.8zla.com",https://datatooltrove.8zla.com/,2026-07-14T01:43:00+00:00,"#AIdataanalysistools, #freetool, #comparison, #nocode, #indiehacker"
How to Best AI Data Analysis Tools of 2026: Pricing & Features Comparison,https://gomovecalc.xyz/pins/pin-222.png,AI Data Tools,Step-by-step: use our free AI data analysis tools to get accurate estimates in 30 seconds. No email required.,https://datatooltrove.8zla.com/,2026-07-14T03:13:00+00:00,"#AIdataanalysistools, #freetool, #comparison, #nocode, #indiehacker"
FuseLens vs Paying a Pro: Real Cost Difference,https://gomovecalc.xyz/pins/pin-223.png,AI Data Tools,"Before you hire someone, run the numbers. Free AI data analysis tools saves you from overpaying. datatooltrove.8zla.com",https://datatooltrove.8zla.com/,2026-07-14T03:05:00+00:00,"#AIdataanalysistools, #freetool, #comparison, #nocode, #indiehacker"
One Thing Most People Get Wrong About AI data analysis tools,https://gomovecalc.xyz/pins/pin-224.png,AI Data Tools,Don't guess — calculate. Our free tool uses real industry data. datatooltrove.8zla.com,https://datatooltrove.8zla.com/,2026-07-14T04:14:00+00:00,"#AIdataanalysistools, #freetool, #comparison, #nocode, #indiehacker"
FuseLens: The Free Tool That Replaces Spreadsheets,https://gomovecalc.xyz/pins/pin-225.png,AI Data Tools,"No Excel, no math, no signup. Just open and calculate. AI data analysis tools — datatooltrove.8zla.com",https://datatooltrove.8zla.com/,2026-07-14T05:40:00+00:00,"#AIdataanalysistools, #freetool, #comparison, #nocode, #indiehacker"
Real Numbers: What AI data analysis tools Actually Costs in 2026,https://gomovecalc.xyz/pins/pin-226.png,AI Data Tools,Updated 2026 pricing data. Free AI data analysis tools with breakdown by category. datatooltrove.8zla.com,https://datatooltrove.8zla.com/,2026-07-14T06:04:00+00:00,"#AIdataanalysistools, #freetool, #comparison, #nocode, #indiehacker"
Which AI Option Is Right For You?,https://gomovecalc.xyz/pins/pin-227.png,AI Data Tools,Answer 3 quick inputs and our free calculator tells you. No signup. datatooltrove.8zla.com,https://datatooltrove.8zla.com/,2026-07-14T07:42:00+00:00,"#AIdataanalysistools, #freetool, #comparison, #nocode, #indiehacker"
Before Buying AI data: Run This First,https://gomovecalc.xyz/pins/pin-228.png,AI Data Tools,5 minutes of planning saves thousands. Free AI data analysis tools → datatooltrove.8zla.com,https://datatooltrove.8zla.com/,2026-07-14T08:33:00+00:00,"#AIdataanalysistools, #freetool, #comparison, #nocode, #indiehacker"
The Ultimate AI data analysis tools Checklist (Free Tool Inside),https://gomovecalc.xyz/pins/pin-229.png,AI Data Tools,Everything you need to know before starting. Plus a free calculator. datatooltrove.8zla.com,https://datatooltrove.8zla.com/,2026-07-14T10:01:00+00:00,"#AIdataanalysistools, #freetool, #comparison, #nocode, #indiehacker"
Industry Secret: How Pros Estimate AI data Costs,https://gomovecalc.xyz/pins/pin-230.png,AI Data Tools,We reverse-engineered professional pricing formulas. Try them free. datatooltrove.8zla.com,https://datatooltrove.8zla.com/,2026-07-14T10:25:00+00:00,"#AIdataanalysistools, #freetool, #comparison, #nocode, #indiehacker"
Stop Perk combinations not supported,https://gomovecalc.xyz/pins/pin-231.png,Game Weapons,"Tired of Perk combinations not supported? Try this free game weapon comparison — no signup, instant results. weaponwise.8zla.com",https://weaponwise.8zla.com/,2026-07-15T01:34:00+00:00,"#gameweaponcomparison, #freetool, #comparison, #nocode, #indiehacker"
How to Airsoft Rifle Type Comparison: AEG vs Spring Sniper vs Gas Blowback,https://gomovecalc.xyz/pins/pin-232.png,Game Weapons,Step-by-step: use our free game weapon comparison to get accurate estimates in 30 seconds. No email required.,https://weaponwise.8zla.com/,2026-07-15T03:09:00+00:00,"#gameweaponcomparison, #freetool, #comparison, #nocode, #indiehacker"
WeaponWise vs Paying a Pro: Real Cost Difference,https://gomovecalc.xyz/pins/pin-233.png,Game Weapons,"Before you hire someone, run the numbers. Free game weapon comparison saves you from overpaying. weaponwise.8zla.com",https://weaponwise.8zla.com/,2026-07-15T03:38:00+00:00,"#gameweaponcomparison, #freetool, #comparison, #nocode, #indiehacker"
One Thing Most People Get Wrong About game weapon comparison,https://gomovecalc.xyz/pins/pin-234.png,Game Weapons,Don't guess — calculate. Our free tool uses real industry data. weaponwise.8zla.com,https://weaponwise.8zla.com/,2026-07-15T04:26:00+00:00,"#gameweaponcomparison, #freetool, #comparison, #nocode, #indiehacker"
WeaponWise: The Free Tool That Replaces Spreadsheets,https://gomovecalc.xyz/pins/pin-235.png,Game Weapons,"No Excel, no math, no signup. Just open and calculate. game weapon comparison — weaponwise.8zla.com",https://weaponwise.8zla.com/,2026-07-15T06:13:00+00:00,"#gameweaponcomparison, #freetool, #comparison, #nocode, #indiehacker"
Real Numbers: What game weapon comparison Actually Costs in 2026,https://gomovecalc.xyz/pins/pin-236.png,Game Weapons,Updated 2026 pricing data. Free game weapon comparison with breakdown by category. weaponwise.8zla.com,https://weaponwise.8zla.com/,2026-07-15T06:06:00+00:00,"#gameweaponcomparison, #freetool, #comparison, #nocode, #indiehacker"
Which game Option Is Right For You?,https://gomovecalc.xyz/pins/pin-237.png,Game Weapons,Answer 3 quick inputs and our free calculator tells you. No signup. weaponwise.8zla.com,https://weaponwise.8zla.com/,2026-07-15T07:14:00+00:00,"#gameweaponcomparison, #freetool, #comparison, #nocode, #indiehacker"
Before Buying game weapon: Run This First,https://gomovecalc.xyz/pins/pin-238.png,Game Weapons,5 minutes of planning saves thousands. Free game weapon comparison → weaponwise.8zla.com,https://weaponwise.8zla.com/,2026-07-15T09:10:00+00:00,"#gameweaponcomparison, #freetool, #comparison, #nocode, #indiehacker"
The Ultimate game weapon comparison Checklist (Free Tool Inside),https://gomovecalc.xyz/pins/pin-239.png,Game Weapons,Everything you need to know before starting. Plus a free calculator. weaponwise.8zla.com,https://weaponwise.8zla.com/,2026-07-15T09:02:00+00:00,"#gameweaponcomparison, #freetool, #comparison, #nocode, #indiehacker"
Industry Secret: How Pros Estimate game weapon Costs,https://gomovecalc.xyz/pins/pin-240.png,Game Weapons,We reverse-engineered professional pricing formulas. Try them free. weaponwise.8zla.com,https://weaponwise.8zla.com/,2026-07-15T10:18:00+00:00,"#gameweaponcomparison, #freetool, #comparison, #nocode, #indiehacker"
Stop Too many ads and popups,https://gomovecalc.xyz/pins/pin-241.png,Game NPC Database,"Tired of Too many ads and popups? Try this free game NPC database — no signup, instant results. npcvault.8zla.com",https://npcvault.8zla.com/,2026-07-16T01:42:00+00:00,"#gameNPCdatabase, #freetool, #comparison, #nocode, #indiehacker"
How to Best Game NPC Database Tools Compared,https://gomovecalc.xyz/pins/pin-242.png,Game NPC Database,Step-by-step: use our free game NPC database to get accurate estimates in 30 seconds. No email required.,https://npcvault.8zla.com/,2026-07-16T02:16:00+00:00,"#gameNPCdatabase, #freetool, #comparison, #nocode, #indiehacker"
NPCVault vs Paying a Pro: Real Cost Difference,https://gomovecalc.xyz/pins/pin-243.png,Game NPC Database,"Before you hire someone, run the numbers. Free game NPC database saves you from overpaying. npcvault.8zla.com",https://npcvault.8zla.com/,2026-07-16T04:05:00+00:00,"#gameNPCdatabase, #freetool, #comparison, #nocode, #indiehacker"
One Thing Most People Get Wrong About game NPC database,https://gomovecalc.xyz/pins/pin-244.png,Game NPC Database,Don't guess — calculate. Our free tool uses real industry data. npcvault.8zla.com,https://npcvault.8zla.com/,2026-07-16T04:51:00+00:00,"#gameNPCdatabase, #freetool, #comparison, #nocode, #indiehacker"
NPCVault: The Free Tool That Replaces Spreadsheets,https://gomovecalc.xyz/pins/pin-245.png,Game NPC Database,"No Excel, no math, no signup. Just open and calculate. game NPC database — npcvault.8zla.com",https://npcvault.8zla.com/,2026-07-16T05:00:00+00:00,"#gameNPCdatabase, #freetool, #comparison, #nocode, #indiehacker"
Real Numbers: What game NPC database Actually Costs in 2026,https://gomovecalc.xyz/pins/pin-246.png,Game NPC Database,Updated 2026 pricing data. Free game NPC database with breakdown by category. npcvault.8zla.com,https://npcvault.8zla.com/,2026-07-16T06:43:00+00:00,"#gameNPCdatabase, #freetool, #comparison, #nocode, #indiehacker"
Which game Option Is Right For You?,https://gomovecalc.xyz/pins/pin-247.png,Game NPC Database,Answer 3 quick inputs and our free calculator tells you. No signup. npcvault.8zla.com,https://npcvault.8zla.com/,2026-07-16T08:03:00+00:00,"#gameNPCdatabase, #freetool, #comparison, #nocode, #indiehacker"
Before Buying game NPC: Run This First,https://gomovecalc.xyz/pins/pin-248.png,Game NPC Database,5 minutes of planning saves thousands. Free game NPC database → npcvault.8zla.com,https://npcvault.8zla.com/,2026-07-16T08:03:00+00:00,"#gameNPCdatabase, #freetool, #comparison, #nocode, #indiehacker"
The Ultimate game NPC database Checklist (Free Tool Inside),https://gomovecalc.xyz/pins/pin-249.png,Game NPC Database,Everything you need to know before starting. Plus a free calculator. npcvault.8zla.com,https://npcvault.8zla.com/,2026-07-16T10:09:00+00:00,"#gameNPCdatabase, #freetool, #comparison, #nocode, #indiehacker"
Industry Secret: How Pros Estimate game NPC Costs,https://gomovecalc.xyz/pins/pin-250.png,Game NPC Database,We reverse-engineered professional pricing formulas. Try them free. npcvault.8zla.com,https://npcvault.8zla.com/,2026-07-16T11:03:00+00:00,"#gameNPCdatabase, #freetool, #comparison, #nocode, #indiehacker"